{
  "artifact": {
    "link": "https://example.com/artifact-source",
    "author": "AuthorName"
  },
  "weapons": {
    "link": "https://example.com/weapon-source",
    "author": "AuthorName"
  },
  "talent": {
    "link": "https://example.com/talent-source",
    "author": "AuthorName"
  },
  "notes": [
    "Amber Melt DPS is a playstyle where she uses Charged Attacks to trigger Melt. Rankings assume she is used with **Bennett**.",
    "When attacking Weak Points, the attacks are guaranteed to Crit, making weapons with Crit Rate substat lose value."
  ]
}